{
  "schemaVersion": 1,
  "freeFood": {
    "meal": {"ko": "식사", "en": "Meal"},
    "lunchbox": {"ko": "도시락", "en": "Lunch box"},
    "snack": {"ko": "간식", "en": "Snack"},
    "refreshment": {"ko": "다과", "en": "Refreshments"},
    "beverage": {"ko": "음료", "en": "Drinks"},
    "coupon": {"ko": "식권", "en": "Meal voucher"},
    "other": {"ko": "기타", "en": "Other"},
    "unknown": {"ko": "", "en": ""}
  },
  "sources": {
    "dooray": {"dataName": "Dooray", "shownAs": "mail"},
    "dooray_mailbox": {"dataName": "Dooray 메일함", "shownAs": "mail"},
    "kaist_public": {"dataName": "KAIST 공지", "newsName": "KAIST 공지", "shownAs": "public"},
    "manual": {"dataName": "Manual", "shownAs": "manual"},
    "portal": {"dataName": "KAIST Portal", "newsName": "KAIST 포탈", "shownAs": "portal"}
  },
  "sourceLabels": {
    "mail": {"ko": "KAIST 메일", "en": "KAIST mail"},
    "portal": {"ko": "KAIST 포탈", "en": "KAIST Portal"},
    "public": {"ko": "KAIST 공식 공지", "en": "KAIST notice"},
    "manual": {"ko": "밥도둑 등록", "en": "Added by Babdoduk"}
  },
  "restaurants": [
    {"id": "fclt", "name": "카이마루 N11", "building": "N11"},
    {"id": "west", "name": "서맛골 W2", "building": "W2"},
    {"id": "east1", "name": "동맛골 학생식당 E5", "building": "E5"},
    {"id": "east2", "name": "동맛골 교직원식당 E5", "building": "E5"},
    {"id": "emp", "name": "교수회관 N6", "building": "N6"},
    {"id": "icc", "name": "문지캠퍼스", "building": "문지"},
    {"id": "hawam", "name": "화암 기숙사", "building": "화암"},
    {"id": "seoul", "name": "서울캠퍼스", "building": "서울"}
  ],
  "cuisines": {
    "byCuisine": {"korean": "한식", "chinese": "중식", "japanese": "일식", "indian": "인도", "fusion": "퓨전"},
    "byGroup": {
      "korean": "한식", "chinese": "중식", "japanese": "일식", "southeast-asian": "동남아", "indian": "인도",
      "middle-eastern": "중동", "western": "양식", "american": "양식", "italian": "양식", "french": "양식",
      "mexican": "양식", "fusion": "퓨전", "snack": "분식", "dessert": "디저트"
    }
  },
  "magazineLanes": {
    "tips": {
      "name": {"ko": "요리 비법", "en": "Kitchen notes"},
      "lead": {"ko": "밥이 더 맛있어지는 작은 조리 팁", "en": "Small cooking moves that make rice taste better"}
    },
    "trend": {
      "name": {"ko": "요즘 먹방 유행", "en": "What's in"},
      "short": {"ko": "먹방 유행", "en": "What's in"},
      "lead": {"ko": "요즘 사람들이 뭘 먹고 있는지", "en": "What people are eating right now"}
    },
    "health": {
      "name": {"ko": "건강한 한 끼", "en": "A lighter plate"},
      "lead": {"ko": "맛도 포기하지 않는 건강식", "en": "Lighter food that still tastes like dinner"}
    },
    "habit": {
      "name": {"ko": "식습관", "en": "How we eat"},
      "lead": {"ko": "잘 먹는 법에 대한 작은 이야기", "en": "Small notes on eating well"}
    }
  }
}
